{
  "backupVersion": 1,
  "mode": "replace",
  "confirmReplace": true,
  "dataset": {
    "filename": "verified-resources.csv",
    "sha256": "5e9a8438ee652c9be5b44fb781a2ba94db9dafffddcc720c254bc291aab2d72b",
    "rowCount": 114
  },
  "resources": [
    {
      "id": "cms8ta9kp007vomm1qfjmsei6",
      "name": "Cantor Law Group",
      "acronym": null,
      "description": "Law firm previously supplied as a possible resource.",
      "category": "attorneys-firms",
      "sourceCategory": null,
      "subcategory": null,
      "phoneRaw": "602-254-8880",
      "phoneNormalized": "6022548880",
      "phoneDisplay": "(602) 254-8880",
      "email": null,
      "website": "https://cantorlawgroup.com",
      "address": "40 N Central Ave Ste 2310, Phoenix, AZ 85004",
      "tags": "Cantor Law Group, attorney, firm",
      "priority": 0,
      "verified": true,
      "published": true,
      "sourceNote": null,
      "piipassNotes": "Phone normalized: \"602-691-6364\" → 6026916364",
      "createdAt": "2026-07-31T10:40:32.762Z",
      "updatedAt": "2026-07-31T10:40:32.762Z",
      "sourceRow": 2
    },
    {
      "id": "cms8ta9kq007xomm1c17snrot",
      "name": "Cohen Family Law",
      "acronym": null,
      "description": "Family-law firm previously supplied as a possible resource.",
      "category": "attorneys-firms",
      "sourceCategory": null,
      "subcategory": null,
      "phoneRaw": "602-714-8898",
      "phoneNormalized": "6027148898",
      "phoneDisplay": "(602) 714-8898",
      "email": null,
      "website": "https://cohenfamilylaw.com",
      "address": "3003 N Central Ave Ste 2606, Phoenix, AZ 85012",
      "tags": "Cohen Family Law, attorney, firm",
      "priority": 0,
      "verified": true,
      "published": true,
      "sourceNote": null,
      "piipassNotes": "no changes",
      "createdAt": "2026-07-31T10:40:32.763Z",
      "updatedAt": "2026-07-31T10:40:32.763Z",
      "sourceRow": 3
    },
    {
      "id": "cms8ta9ku0083omm1gm45p86x",
      "name": "Colburn Hintze Maletta",
      "acronym": "CHM",
      "description": "Arizona law firm previously supplied as a possible resource.",
      "category": "attorneys-firms",
      "sourceCategory": null,
      "subcategory": null,
      "phoneRaw": "602-825-2500",
      "phoneNormalized": "6028252500",
      "phoneDisplay": "(602) 825-2500",
      "email": null,
      "website": "https://chmlaw.com",
      "address": "2150 E Highland Ave Ste 212, Phoenix, AZ 85016",
      "tags": "Colburn Hintze Maletta, CHM, Arizona, attorney",
      "priority": 0,
      "verified": true,
      "published": true,
      "sourceNote": null,
      "piipassNotes": "Phone normalized: \"602-825-2500\" → 6028252500 | Website normalized: \"chmlaw.com\" → https://chmlaw.com",
      "createdAt": "2026-07-31T10:40:32.766Z",
      "updatedAt": "2026-07-31T10:40:32.766Z",
      "sourceRow": 4
    },
    {
      "id": "cms8ta9kx0087omm1ag6m1ats",
      "name": "Coolidge Law Firm",
      "acronym": null,
      "description": "Chandler law firm. Current contact information is taken from the firm's official website.",
      "category": "attorneys-firms",
      "sourceCategory": null,
      "subcategory": null,
      "phoneRaw": "480-264-5111",
      "phoneNormalized": "4802645111",
      "phoneDisplay": "(480) 264-5111",
      "email": null,
      "website": "https://coolidgelawfirmaz.com",
      "address": "1820 E Ray Rd, Chandler, AZ 85225",
      "tags": "Coolidge Law Firm, attorney, firm",
      "priority": 0,
      "verified": true,
      "published": true,
      "sourceNote": "Live-verified 2026-08-03: https://coolidgelawfirmaz.com | Official firm phone 480-264-5111.",
      "piipassNotes": "Phone corrected: \"480-246-5111\" → 4802645111",
      "createdAt": "2026-07-31T10:40:32.770Z",
      "updatedAt": "2026-08-03T09:16:04.317Z",
      "sourceRow": 5
    },
    {
      "id": "cms8ta9kr007zomm1zqzjgf7v",
      "name": "Cordell & Cordell",
      "acronym": null,
      "description": "Domestic-relations law firm with a focus on fathers’ rights; previously supplied as a possible resource.",
      "category": "attorneys-firms",
      "sourceCategory": null,
      "subcategory": null,
      "phoneRaw": "623-401-2002",
      "phoneNormalized": "6234012002",
      "phoneDisplay": "(623) 401-2002",
      "email": null,
      "website": "https://cordellcordell.com",
      "address": "16150 N Arrowhead Fountains Center Dr Ste 135, Peoria, AZ 85382",
      "tags": "Cordell & Cordell, fathers rights, domestic relations",
      "priority": 0,
      "verified": true,
      "published": true,
      "sourceNote": null,
      "piipassNotes": "Website normalized: \"cordellcordell.com\" → https://cordellcordell.com",
      "createdAt": "2026-07-31T10:40:32.764Z",
      "updatedAt": "2026-07-31T10:40:32.764Z",
      "sourceRow": 6
    },
    {
      "id": "cms8ta9ks0081omm1bckll5gv",
      "name": "DeShon Laraye Pullen PLC",
      "acronym": null,
      "description": "Arizona family and domestic-relations law firm previously supplied as a possible resource.",
      "category": "attorneys-firms",
      "sourceCategory": null,
      "subcategory": null,
      "phoneRaw": "602-834-7005",
      "phoneNormalized": "6028347005",
      "phoneDisplay": "(602) 834-7005",
      "email": null,
      "website": "https://deshonpullenlaw.com",
      "address": "80 E Columbus Ave, Phoenix, AZ 85012",
      "tags": "DeShon Laraye Pullen, Arizona, family law",
      "priority": 0,
      "verified": true,
      "published": true,
      "sourceNote": null,
      "piipassNotes": "Phone normalized: \"800-409-0262\" → 8004090262",
      "createdAt": "2026-07-31T10:40:32.765Z",
      "updatedAt": "2026-07-31T10:40:32.765Z",
      "sourceRow": 7
    },
    {
      "id": "cms8ta9kr007yomm1tp9g6kag",
      "name": "Faussette & Faussette PLLC",
      "acronym": null,
      "description": "Law firm previously supplied as a possible resource.",
      "category": "attorneys-firms",
      "sourceCategory": null,
      "subcategory": null,
      "phoneRaw": "602-905-2833",
      "phoneNormalized": "6029052833",
      "phoneDisplay": "(602) 905-2833",
      "email": null,
      "website": "https://faussettelaw.com",
      "address": "3800 N Central Ave Ste 615, Phoenix, AZ 85012",
      "tags": "Faussette & Faussette, attorney, firm",
      "priority": 0,
      "verified": true,
      "published": true,
      "sourceNote": null,
      "piipassNotes": "no changes",
      "createdAt": "2026-07-31T10:40:32.763Z",
      "updatedAt": "2026-07-31T10:40:32.763Z",
      "sourceRow": 8
    },
    {
      "id": "cms8ta9ku0085omm1caccsd00",
      "name": "Frank Amar Matura",
      "acronym": null,
      "description": "Law firm previously supplied as a possible resource.",
      "category": "attorneys-firms",
      "sourceCategory": null,
      "subcategory": null,
      "phoneRaw": "602-922-9989",
      "phoneNormalized": "6029229989",
      "phoneDisplay": "(602) 922-9989",
      "email": null,
      "website": "https://famlawaz.com",
      "address": "2325 E Camelback Rd Ste 400, Phoenix, AZ 85016",
      "tags": "Frank Amar Matura, attorney, firm",
      "priority": 0,
      "verified": true,
      "published": true,
      "sourceNote": null,
      "piipassNotes": "no changes",
      "createdAt": "2026-07-31T10:40:32.767Z",
      "updatedAt": "2026-07-31T10:40:32.767Z",
      "sourceRow": 9
    },
    {
      "id": "cms8ta9kz0089omm1j3j0edty",
      "name": "Garcia Law Firm PLC",
      "acronym": null,
      "description": "Phoenix law firm previously supplied as a possible resource.",
      "category": "attorneys-firms",
      "sourceCategory": null,
      "subcategory": null,
      "phoneRaw": "602-340-1999",
      "phoneNormalized": "6023401999",
      "phoneDisplay": "(602) 340-1999",
      "email": null,
      "website": "https://bernardogarcialaw.com",
      "address": "827 N 5th Ave, Phoenix, AZ 85003",
      "tags": "Garcia Law Firm, Phoenix, attorney",
      "priority": 0,
      "verified": true,
      "published": true,
      "sourceNote": null,
      "piipassNotes": "Phone normalized: \"602-340-1999\" → 6023401999",
      "createdAt": "2026-07-31T10:40:32.772Z",
      "updatedAt": "2026-07-31T10:40:32.772Z",
      "sourceRow": 10
    },
    {
      "id": "cms8ta9kx0086omm1b2oirdlv",
      "name": "Gurion Legal",
      "acronym": null,
      "description": "Phoenix law firm. Current contact information is taken from the firm's official website.",
      "category": "attorneys-firms",
      "sourceCategory": null,
      "subcategory": null,
      "phoneRaw": "480-800-0020",
      "phoneNormalized": "4808000020",
      "phoneDisplay": "(480) 800-0020",
      "email": null,
      "website": "https://gurionlegal.com",
      "address": "4323 N 12th St, Suite 100, Phoenix, AZ 85014",
      "tags": "Gurion Legal, attorney, firm",
      "priority": 0,
      "verified": true,
      "published": true,
      "sourceNote": "Live-verified 2026-08-03: https://gurionlegal.com | Phone and Phoenix office confirmed.",
      "piipassNotes": "no changes",
      "createdAt": "2026-07-31T10:40:32.769Z",
      "updatedAt": "2026-08-03T09:16:04.317Z",
      "sourceRow": 11
    },
    {
      "id": "cms8ta9ky0088omm1krysn5k0",
      "name": "Salwin Law Group",
      "acronym": null,
      "description": "Law firm previously supplied as a possible resource.",
      "category": "attorneys-firms",
      "sourceCategory": null,
      "subcategory": null,
      "phoneRaw": "480-702-1789",
      "phoneNormalized": "4807021789",
      "phoneDisplay": "(480) 702-1789",
      "email": null,
      "website": "https://www.salwinlaw.com",
      "address": "7702 E Doubletree Ranch Rd, Ste 300, Scottsdale, AZ 85258",
      "tags": "Salwin Law Group, attorney, firm",
      "priority": 0,
      "verified": true,
      "published": true,
      "sourceNote": null,
      "piipassNotes": "Added phone and website after live verification.",